,Topic,Count,Name,Representation,Representative_Docs,Rep_Words,Doc_Count
1,0,5273,0_covid_vaccine_people_just,"['covid', 'vaccine', 'people', 'just', 'china', 'like', 'vaccines', 'did', 'years', 'know']","['>>504649906How retarded does someone have to be to believe this? I saw this earlier and I genuinely didnt even realize what it was implying. Its not until now, my second time seeing it, that people are implying that the AstraZeneca vaccine is actually a secret code word in Latin which is supposed to be broadcasting sinister intent. Its sad for two reasons, first because its such obvious bullshit and Latin doesnt look anything like that, but also because the COVID vaccine was actually harmful, and it wasnt very effective, but because retards are pushing the idea that it kills people and is some intentional satanic plot, nobody will take the real issue seriously, that being that greedy corporations used our government to sell their own harmful, ineffective product which they falsely claimed to the public was not inly safe, effective, but also borderline necessary, and did not quietly admit that the vaccine does pose health risks until years later, and it barely got any news coverage. This is why I dont identify as anti-vaxx, because most vaccines are genuinely amazing, as well as being generally harmless except for a very small percentage of the population with particular genetic traits. That being said, every vaccine has advantages and disadvantages, and I believe everyone should do research on the vaccines they are considering, and pick and choose which ones they deem necessary based on their own personal factors, risk to benefit ratio, and lifestyle choices, but because a bunch of retarded schizophrenic Q followers who believe the Annunaki built the pyramids go around telling people not to give your kids the polio vaccine because it will give them autism, or that the COVID vaxx has microchips and will kill you, nobody takes me seriously when I say that the whole COVID vaccine fiasco represents a serious threat to public health', '>>505153113Count yourself lucky you weren\'t in Australia during the scamdemic. It actually makes me angry how everyone and their mother turned against me.I couldn\'t rent places because everyone wanted to see my vaccine passport.I was fired from my job because I could no longer attend the office.I was barred from going to stores. They had ""guards"" who would check that your vaccine passport was current before letting you in.I was locked in my house and wasn\'t allowed out while vaccinated people were. $5,000 fine for leaving my front door.I wasn\'t even able to get a haircut for like 2 years, just because the government said barbers and hairdressers are high-risk covid hotspots.I lost friends and family because they thought I was insane and would laugh at me behind my back. And sometimes tell me they did so, just to try and shame me into getting the was absolute hell in Australia for the unvaccinated, and I will never, ever forgive the people of this country for doing that to me. I have zero loyalty to this country now and I wish a slow and painful death on all those who played into this fucking this play out in real time shattered my faith in humanity.', '>>506028345everything is the vaxxand before that everything was ""covid""']","0, covid, vaccine, people, just",5273
2,1,627,1_jews_jewish_jew_covid,"['jews', 'jewish', 'jew', 'covid', 'goyim', 'israel', 'like', 'people', 'just', 'did']","['Most importantly, don\'t allow the public to forget or become distracted from the biggest Jewish attack on America yet -- COVID! >""Jewish militias like Antifa were attacking our cities, Jewish officials were mandating lockdowns, Jewish vaccine companies were forcing poison on 3 generations of Americans including defenseless children!""And if any Jew tries to tell you the vaccines are safe and effective, do remind the public that COVID was a full-spectrum attack on America, perpetrated by Jews, of which the vaccines were only one part. And all those Israel-supporters waving the American flag? Where the fuck were they during COVID? Oh right, they were in on it too, because Jews always play both sides to murder Goyim. Remind the public they didn\'t do anything until people started protesting against Israel.', '>>502375631>>502376131Jews know that Goyim know that Jews worked together to genocide Goyim with those vaccines, and they\'re desperately trying to plan for the great retribution. They really, really, actually thought that they can hide amongst Goyim without being identified by sight and speech, ""passing as Goyim"" (they actually use this terminology on Reddit) like a good tranny ""passes"" for being female. This is only a half-ass effort of some Jews to try and save their own asses. Then all Jews can just say, ""Yeah we\'re the good Jews, not the ones who poisoned you"" even though all Jews participated in the COVID attacks against humanity. It\'s a lot like the Republican/Democrat or Israel/Ukraine game they play, even though they\'re all the same fucking rats behind the same fucking curtain. Everybody knows what Jews look like and where their neighborhoods are. Everybody knows Jews poisoned everybody else with those vaccines.', '>>502459907Anyway, in the coming months, we are going to see some serious Jewish mitosis coming from Israeli Jews. We\'re going to see Israeli Jews distancing themselves from diaspora Jews, and we\'re going to see other Israeli Jews distance themselves from ""Israel deep state"" Jews. But why? Well, it\'s because COVID was a multi-spectrum Jewish attack against America:>Jewish militias like Antifa providing physical attacks>Jewish officials like the CDC\'s Rochelle Walensky mandating lockdowns and vaccines>Jewish vaccine companies profiting from manufacturing the poison to be forced upon Goyim. 3 or 4 generations of Americans, including defenseless children, were coerced into being condemned to a slow, painful death in taking the Jewish vaccines. We are at the point where it is becoming impossible to ignore as the mainstream media is trying to normalize heart conditions, strokes, and aggressive cancers in healthy children. This is where Jewish mitosis will start as I described above. Jews will be desperate to save their own asses, but remember (webm related), they were ALL in on it.']","1, jews, jewish, jew, covid",627
3,2,523,2_clot_clot shot_shot_clotshot,"['clot', 'clot shot', 'shot', 'clotshot', 'got', 'took', 'took clot', 'took clot shot', 'got clot shot', 'got clot']","['>>493720813Took the clot shot', '>>105297953the clot shot', '>>501242579could be the clot shot.']","2, clot, clot shot, shot, clotshot",523
4,3,232,3_ukraine_russia_war_putin,"['ukraine', 'russia', 'war', 'putin', 'russian', 'like', 'russians', 'nato', 'covid', 'europe']","["">>498588629Allowing the Americans to pay money to be in the #1 spot has gone on too long. Naturally they are not the worlds #1 power, europe is potentially at least 3 times more powerful than the US. It is more powerful than US, UK & china combined. Russia is NOT a great power. Treating Russia as a power is a joke. Russia was never a great power except for a brief moment mid 20th century and that power was based on 2 things>a man with a rifle being the apex of military power>russias vast population in comparison to other nations allowing them to steam roll with endless of those things are still the case. Russia in fact doesnt even have a 2:1 advantage against the UK anymore. Any country like the UK, France, Germany could quite readily kick their assholes in since the quality of russians is so low and they are no longer comparatively just pointed out that russias professional army is all dead and their black seas fleet has been sank. They are no better than argentina tier at best and their failure to win a war vs ukraine only proves that they are weak - its total realworld wants to attack russia. He said he wants to defend ukraine with troops on the ground but said he wants other european countries to join in and America to provide a backstop (Google it). I agree, Britain should seize Russia's natural resources and disarm/liberate Russia, permanently. Trump treating Russia as a great power is retarded but unfortunately back in 2015 i used to larp at supporting putin to annoy wokeys. Straight after the covid hoax while i and others were fatigued from covid & vax arguing russian shills capitalised on our absence from the internet by pretending to be us and telling boomer-with-a-computer that russia are the white hats (cringe). They like all the brics are in point of fact cucked by jews & globo more than any other countries. They are ruled not subverted by big corrupt money."", '>>496072103Wars the biggest scam ever and rootin tootin putin is providing it for his partners all over the world to profit from. In the first few days he assassinated ten russian generals, cant have them simply winning and overrunning Ukraine. Zelensky took the credit and our fake news spread the myth. Then suddenly the super capable Ukrainian security services couldnt do shit, apparently they were only super-assassins for two weeks before becoming turnip fingered dolts, if you were to believe the myth. The only person it could have been killing russian generals inside russia was Putin, the KGB got a personal fortune that was @ a third of a trillion (with a t) dollars before the war, where did he get that from?Zekensky had just been caught with 5 billion dollars stuffed into a secret Panama bank account too. And now while they have everyone dying in a pointless fight which nobody is allowed to ever win money is flying in and hes just trusted like hed never steal anything. >russiaThe oligarchs want to make sure there is never any progress and the vast wealth from russias natural resources never goes to the people it only goes to them. So they will crash russia to restart the bitter cycle that produced the oligarchy and make sure that putin is replaced by putin-2 when he dies or goes senile.>ukraineThe jews have had a plan to create a babylon state ruled by them since a jew wrote a book on it back in the 1920s. War with russia is the means to that end in their plan. Its not even all a dirty scam. Like the covid hoax was. A heist. If they did not want what is happening to be happening they would stop it.', 'Trumpy is still in 2015 in his head back when i used to larp at supporting Putin while colourful balaclava dykes stalked him, i was only trying to annoy the bluehaired crazies of social i found out who he was and posted it all here with links and pics of young effeminate jewish putird in his little hat with his entirely little hat family out jewwing. His early life was a simple google then. At the end of the covid hoax when the jewish war SCAM began and was all fake news bullshit i googled it and everything was memory holed. You could still find a lot oc it but it wasnt just a ten second google search. This is the western media snd big tech who memory holed putins jewish identity.>yes hes probably jewish but that would be like the protocols Said one mainstream Israeli publication i linked. I was fatigued from covid & vax exposing and ignored the ukraine shite which was onvious fake news for ages at the start - russuan shills though were VERY busy pretending to be me & people likd me and telling boomer-with-a-computer that putin was not globohomo (hes homo, globo). I hate russian shills who lie like schizo jews and of course Poo, who is excessively propagandised just like russians & chink cucks. This board is banned in russia & china BTW. Appart from kremling shills thats Poo cheerleading for Puturd. Its traditional to lie about not being jewish in russian politics BTW. But russia is entirely ruled by jews. Zelensky was always a puturd gang member.']","3, ukraine, russia, war, putin",232
5,4,223,4_people_shit_like_just,"['people', 'shit', 'like', 'just', 'right', 'trump', 'war', 'covid', 'media', 'propaganda']","['>2019 Trump starts trade war with china>2020 china releases covid and fills news with propaganda, crashes global economy>2025 Trump starts trade war with china>china suddenly has miracle AI that undercuts US and shills it everywhere>economy crashes againStrange coincidence', '>>505102957>Overall, I think we are much closer to imperial collapse than people realize.I agree. I think that Trump was responsible for operation warp speed that led to mRNA vaccinations, cutting corners and being in introduced to human populations. I think Covid lockdowns were NATO operation. I think that a lot of financial stimulus was introduced in Trumps first term setting the stage for Biden to do more damage. I do believe if Biden or Harris wouldve won we wouldve seen imperial collapse as you say in 2025 this year. I think that they were well aware of this and this is the basis of the Deagels population forecasts for 2025. If you read over the archives that website basically says financial ruin in the west leads to mass migrations out of modern nations and additionally pandemics. The population changes the US were suicides due to the social contract being changed indefinitely due to bankruptcy insolvency, etc. I think thats a very possible outcome thats been avoided with Trump is doing now. Similar to Covid. He seemed to fast track everything while still pushing some of the overall agenda of some invisible globalization effort. So I think with Trump things are slower changes for the existing citizenry, where is Obama really did deliver the change he promised. I see these two as the anti-cycle. I believe this was all intentionally done after a surprise soft collapse that caught them off guard in 2008. Thats what all the hate bigotry racism, divisiveness tribalism, etc. was systematically introduced into our mainstream media and social media. I also believe a lot of those extremes that came to past since 2016 were the establishments attempt at training AI illegally using public sources on the Internet through big technology companies. This is why a lot of the propaganda woke. Propaganda seemed insane because they were trying to train AI models to uphold their social contract ideologies. Sorry I know thats a lot of bullshit to read.', "">>207334927>Banning TikTok was immensely why would you think they'd care, if they wanted to control information?>If they tried to censor the entire internet and all social media, I can only imagine how much worse it would beYou mean, like they didn't for tiktok, when they did it for covid, or for the Hunter Biden Laptop?>People would riot They wouldn't.>Nvm the logistics of how they'd do that without something like Chinas great firewallRun articles in the newspapers, and tell social media what they do, or they lose their platform protections.>Every young person is terminally online. No one besides boomers watches t.v newsGood thing the Boomers are the most politically engaged to vote then. Just run propaganda on social media, that makes Zoomers not want to vote.>Right and my point is that so can enemy governments. So everytime zoom zooms turn on their phones they can potentially see fake (or real) images intending to demoralize themDoing your government's work for them.>Our own gov doesn't have a monopoly on propaganda anymoreThey never did. Which is why there were so much pro-commie reporting from your newspapers.""]","4, people, shit, like, just",223
6,5,201,5_eggs_chickens_egg_bird,"['eggs', 'chickens', 'egg', 'bird', 'bird flu', 'flu', 'prices', 'food', 'chicken', 'birds']","['Why is bird flu being blown out of proportion? They found a couple cases of bird flu so all 100k ducks at this farm in New York all had to be put down. Bird flu has been an off and on thing since the 1980s but why is it only now are they taking unnessary drastic measures to supposedly contain it? Bird flu in the past never effected the price of poultry or eggs in any major way but it seems like after Covid now the prices must only go up and bird flu just seems like a convient excuse to do it, why?', '>>497268982>BIDEN INFLATION IS UP!The Biden and Co camp realized eggs hurt covid jabs and they have been trying to cull as many chickens and egg layers as possible. The meat birds they dont care about, its the egg layers and eggs they care about. This is why they have burned hundreds of millions of birds, sabotaged and caught hen houses on fire, and destroyed hundreds of millions of eggs. All this to artificially limit egg production, to increase egg prices, to stop people from buying eggs which reverses the jab effects and also helps you not catch covid. Also the artificially high prices make Trump look bad because OrangeManBad', '>>499325827Stop charging so much. Idiots. The price of eggs is based on the supply the gtocery stores control by their choice of supplier. They could pay more for better eggs and sell them at a slightly higher rate, but instead choose to raise prices and say ""supply and demand goy"". It\'s an imaginary problem. We bought so many eggs from you it lowered your supply, so now we get a discount right? More expensive? Okay. See, I\'m an econ major now. Were any of the fires investigated for arson? Was the bird flu tested for lab traces seeing as china is our enemy? Why didn\'t we assume china dropped bird flu in the US like people were led to with covid? It\'s not even a topic. You see my little frens... it\'s because they are making the plays together. Bird flu will come to you. They are trying so hard. I think they will blame it on ""public hysteria causing egg farmers to rush eggs"" they will ""forget to test them"" or some shit. Bird flu is up, the eggs are your key. Fertility RIP']","5, eggs, chickens, egg, bird",201
7,6,175,6_canada_canadians_trudeau_canadian,"['canada', 'canadians', 'trudeau', 'canadian', 'country', 'covid', 'like', 'government', 'just', 'jeets']","['>noooooooo canada is a real country!Canada will never be a real country. Literal troon country>YWNBAC is just boomers brainwashed by the CBC who also controls all private mediaNo free press or speech in Canada. not American therefore I\'m CanadianThis is all the Canadian ""patriot"" has to are literal gibmedat Americans sucking the American they see themselves realigning with the evil antiwhite islamified UK as a solution to Trump\'s tarriffs. have a better chance as whites in a free America.>speak English like Americans>anglo roots like Americans>consume American products>proud of left wing liberal ideals stolen from AmericaEven the memes are American, see picrel.-Chinese inflitrationCrickets-violating trucker protestor\'s basic rightsCrickets-covid locksownsCrickets-violating democratic principlesCrickets>oh my GOD Trump is saying things about Canada!?! I\'M GONNA PATRIOOOOOOOOOT!!!!REMINDER: There are provinces that are nations within the confederation of Canada, but they are pitted against each other by a family compact that operates out of the Laurentides. The Irvings, the Seagrams are two major players. Please name wants you disarmed and they want you to shut cancelled guns and speech. They\'ve paid off the boomers and swamped us with IS NOT A COUNTRY. IT NEVER HAS BEEN. CANADA IS A RESOURCE COLONY PEOPLED BY INDENTURED TAX IS LIBERATION', '>>63626098If it were to occur again, let them crank up the false flagging, people could do false flags of their own, the biggest mistakes the convoy made were they should have done a blockade of the Nipigon River bridge & they should have turned Ottawa into Alesia & besieged the city, cutting it off from food, possibly going further and cutting off the supply of natural gas & electricty. If every major transportation corridor going in to Ottawa along with the airport were blockaded it would result in the city starving, if starvation became a more pressing issue in Canada(already is with higher levels of food insecurity) that would motivate the previously unmotivated to act out. I just realize how they criticized convoy members for allegedly taking food from food banks, while their international student jeets do so all of the time. If we can make the international students snap and engage in open as opposed to subversive criminality it will galvanize certain groups in Canada to take a stand against them. Basically if enough strife is created a maple spring will occur. How violent that maple spring gets is up to Canadians. The Canadian government ePlayed misinformation during COVID, Canadians need to do something similar, if social trust and cohesion can be shattered, if the responses of government grind to a halt or completely break down it will go a long way to achieving our goals. Ethnic groups are already in low intensity conflicts, no reason AI couldnt be used to get the Turban Jeets slaughtering the Dot Jeets, and the Chicoms at war with the Kuomintang, Somolians fighting the Jamaicans, no reason that Canada couldnt experience an internal conflict too big for the administration to handle. Also the Boomer vs. everyone but their precious Jeets narrative needs to be pushed, young people need to start roundhouse kicking boomers & jeets into the sun. More people need to file false police reports of suspicious(rapey) jeet behaviour as well.', "">>502233391so true, wasn't Trudeau freezing Truckers' bank accounts during the Covid Lockdown Protests?>>502233950deregulation would help businesses looking to invest. American laws are better for business.>>502235658Canadians are so brainwashed, so many of them just vote for the most idiotic reasons and know nothing about anything but that's because no party is not Jewish, Canada is barely a country, they are a showrunner for the Globalists and Trudeau was the HostCanada sells the globalist lie that a socialist welfare state is the end all be all for poor people around the world, but Canadians are starting to see the reality of that. Not even Canadians want to be Canadian because it doesn't mean anything. At any moment, Sharia Law could be introduced like in the UK and no one could say anything about it or do anything about it. Canada is SnowJew own you. Not even their military or Intelligence fights back. Everyone is compromised by Cartel, China, or the Jew.""]","6, canada, canadians, trudeau, canadian",175
